{
  "$schema": "../../../schemas/engine-api.schema.json",
  "meta_schema_version": "2.0.0",
  "generated_at": "2026-10-27T17:44:55Z",
  "engines": [
    {
      "name": "claude",
      "source": "npm",
      "package": "@anthropic-ai/claude-code"
    },
    {
      "name": "copilot",
      "source": "npm",
      "package": "@github/copilot"
    }
  ],
  "versions": {
    "claude": "2.1.311",
    "copilot": "1.0.104"
  },
  "apis": {
    "claude": {
      "manifest_fields": [],
      "settings_paths": [
        ".claude/settings.json",
        ".claude/settings.local.json"
      ],
      "folder_conventions": [
        ".claude/",
        ".claude/skills/",
        "~/.claude/skills/"
      ],
      "convention_files": [
        {
          "filename": "CLAUDE.md",
          "convention_paths": [
            ".",
            ".claude"
          ]
        }
      ],
      "skill_registration": {
        "notes": "Skills discovered from .claude/skills/ (project) and ~/.claude/skills/ (personal)"
      },
      "lsp_config": {},
      "mcp_config": {
        "notes": "MCP servers configurable; tool names follow mcp__<server>__<tool> pattern"
      },
      "output_styles": [],
      "size_limits": {
        "bash_timeout_max_ms": 600000,
        "notes": "BashInput.timeout max is 600000ms"
      },
      "detection_notes": [
        "Presence of CLAUDE.md in repo root or .claude/ folder"
      ],
      "discovery_notes": [
        "Scans .claude/ folder and ~/.claude/ for skills and settings"
      ],
      "rule_notes": [],
      "tool_calls": [
        {
          "name": "Task",
          "aliases": [
            "Agent"
          ],
          "deprecated": false,
          "notes": "Spawn sub-agent; supports isolation:worktree. New in 2.1.128: 'name' (addressable via SendMessage), 'team_name' (team context), 'mode' (acceptEdits|auto|bypassPermissions|default|dontAsk|plan), 'model' (sonnet|opus|haiku) override."
        },
        {
          "name": "Bash",
          "aliases": [],
          "deprecated": false,
          "notes": "Execute shell command; max timeout 600000ms; supports run_in_background"
        },
        {
          "name": "Edit",
          "aliases": [
            "FileEdit"
          ],
          "deprecated": false,
          "notes": "Edit file content"
        },
        {
          "name": "Read",
          "aliases": [
            "FileRead"
          ],
          "deprecated": false,
          "notes": "Read file; supports text, image, notebook, pdf types"
        },
        {
          "name": "Write",
          "aliases": [
            "FileWrite"
          ],
          "deprecated": false,
          "notes": "Write file content"
        },
        {
          "name": "Glob",
          "aliases": [],
          "deprecated": false,
          "notes": "Glob pattern file search"
        },
        {
          "name": "Grep",
          "aliases": [],
          "deprecated": false,
          "notes": "Search file contents"
        },
        {
          "name": "WebFetch",
          "aliases": [],
          "deprecated": false,
          "notes": "Fetch web URL"
        },
        {
          "name": "WebSearch",
          "aliases": [],
          "deprecated": false,
          "notes": "Web search"
        },
        {
          "name": "TodoWrite",
          "aliases": [],
          "deprecated": false,
          "notes": "Write todo items"
        },
        {
          "name": "mcp",
          "aliases": [
            "McpInput"
          ],
          "deprecated": false,
          "notes": "Invoke MCP tool"
        },
        {
          "name": "list_mcp_resources",
          "aliases": [
            "ListMcpResources"
          ],
          "deprecated": false,
          "notes": "List available MCP resources"
        },
        {
          "name": "read_mcp_resource",
          "aliases": [
            "ReadMcpResource"
          ],
          "deprecated": false,
          "notes": "Read an MCP resource"
        },
        {
          "name": "notebook_edit",
          "aliases": [
            "NotebookEdit"
          ],
          "deprecated": false,
          "notes": "Edit Jupyter notebook cell"
        },
        {
          "name": "ask_user_question",
          "aliases": [
            "AskUserQuestion"
          ],
          "deprecated": false,
          "notes": "Ask user a question interactively"
        },
        {
          "name": "enter_worktree",
          "aliases": [
            "EnterWorktree"
          ],
          "deprecated": false,
          "notes": "Enter a git worktree for isolation"
        },
        {
          "name": "exit_worktree",
          "aliases": [
            "ExitWorktree"
          ],
          "deprecated": false,
          "notes": "Exit a git worktree"
        },
        {
          "name": "exit_plan_mode",
          "aliases": [
            "ExitPlanMode"
          ],
          "deprecated": false,
          "notes": "Exit planning mode"
        },
        {
          "name": "task_output",
          "aliases": [
            "TaskOutput"
          ],
          "deprecated": false,
          "notes": "Emit task output"
        },
        {
          "name": "task_stop",
          "aliases": [
            "TaskStop"
          ],
          "deprecated": false,
          "notes": "Stop a running task"
        },
        {
          "name": "TaskCreate",
          "aliases": [],
          "deprecated": false,
          "notes": "Present in sdk-tools.d.ts of claude-code 2.1.311."
        },
        {
          "name": "TaskGet",
          "aliases": [],
          "deprecated": false,
          "notes": "Present in sdk-tools.d.ts of claude-code 2.1.311."
        },
        {
          "name": "TaskUpdate",
          "aliases": [],
          "deprecated": false,
          "notes": "Present in sdk-tools.d.ts of claude-code 2.1.311."
        },
        {
          "name": "TaskList",
          "aliases": [],
          "deprecated": false,
          "notes": "Present in sdk-tools.d.ts of claude-code 2.1.311."
        },
        {
          "name": "EnterPlanMode",
          "aliases": [],
          "deprecated": false,
          "notes": "Present in sdk-tools.d.ts of claude-code 2.1.311."
        },
        {
          "name": "CronCreate",
          "aliases": [],
          "deprecated": false,
          "notes": "Present in sdk-tools.d.ts of claude-code 2.1.311."
        },
        {
          "name": "CronDelete",
          "aliases": [],
          "deprecated": false,
          "notes": "Present in sdk-tools.d.ts of claude-code 2.1.311."
        },
        {
          "name": "CronList",
          "aliases": [],
          "deprecated": false,
          "notes": "Present in sdk-tools.d.ts of claude-code 2.1.311."
        },
        {
          "name": "ScheduleWakeup",
          "aliases": [],
          "deprecated": false,
          "notes": "Present in sdk-tools.d.ts of claude-code 2.1.311."
        },
        {
          "name": "RemoteTrigger",
          "aliases": [],
          "deprecated": false,
          "notes": "Present in sdk-tools.d.ts of claude-code 2.1.311."
        },
        {
          "name": "Workflow",
          "aliases": [],
          "deprecated": false,
          "notes": "Present in sdk-tools.d.ts of claude-code 2.1.311."
        },
        {
          "name": "Monitor",
          "aliases": [],
          "deprecated": false,
          "notes": "Present in sdk-tools.d.ts of claude-code 2.1.311."
        },
        {
          "name": "PushNotification",
          "aliases": [],
          "deprecated": false,
          "notes": "Present in sdk-tools.d.ts of claude-code 2.1.311."
        },
        {
          "name": "ReportFindings",
          "aliases": [],
          "deprecated": false,
          "notes": "Present in sdk-tools.d.ts of claude-code 2.1.311."
        },
        {
          "name": "ProposeSkills",
          "aliases": [],
          "deprecated": false,
          "notes": "Present in sdk-tools.d.ts of claude-code 2.1.311."
        },
        {
          "name": "ProposeGoal",
          "aliases": [],
          "deprecated": false,
          "notes": "Present in sdk-tools.d.ts of claude-code 2.1.311."
        },
        {
          "name": "Artifact",
          "aliases": [],
          "deprecated": false,
          "notes": "Present in sdk-tools.d.ts of claude-code 2.1.311."
        },
        {
          "name": "RefreshMcpTools",
          "aliases": [],
          "deprecated": false,
          "notes": "Present in sdk-tools.d.ts of claude-code 2.1.311."
        },
        {
          "name": "ReadMcpResourceDir",
          "aliases": [],
          "deprecated": false,
          "notes": "Present in sdk-tools.d.ts of claude-code 2.1.311."
        }
      ],
      "hook_events": [
        {
          "name": "PreToolUse",
          "aliases": [],
          "deprecated": false
        },
        {
          "name": "PostToolUse",
          "aliases": [],
          "deprecated": false
        },
        {
          "name": "PostToolUseFailure",
          "aliases": [],
          "deprecated": false
        },
        {
          "name": "Notification",
          "aliases": [],
          "deprecated": false
        },
        {
          "name": "SessionStart",
          "aliases": [],
          "deprecated": false
        },
        {
          "name": "Stop",
          "aliases": [],
          "deprecated": false
        },
        {
          "name": "StopFailure",
          "aliases": [],
          "deprecated": false
        },
        {
          "name": "SubagentStart",
          "aliases": [],
          "deprecated": false
        },
        {
          "name": "SubagentStop",
          "aliases": [],
          "deprecated": false
        },
        {
          "name": "PreCompact",
          "aliases": [],
          "deprecated": false
        },
        {
          "name": "PostCompact",